lang	dataset	user_type	original_id	gender	segment	tgt	raw_word_count	time_to_edit	suggestion	secs_per_word	parsed_time_to_edit	last_translation	HTER
es	mtgen_a	professional	1068	M	(G was also a writer, but of poetry.	(G también fue escritor, pero de poesía.	8	0	(G también fue escritor, pero de poesía.	0.0	0:00:00	(G también fue escritor, pero de poesía.	0.0
es	mtgen_a	professional	1032	M	Schott later worked as the assistant director of Tualatin Hills United Soccer Club, and coached as part of the Oregon Olympic Development Program.	Más tarde Schott trabajó como director asistente del Tualatin Hills United Soccer Club y fue entrenador como parte del programa de desarrollo Oregon Olympic.	23	24873	Más tarde, Schott trabajó como subdirector del Tualatin Hills United Soccer Club y fue entrenador como parte del Programa de Desarrollo Olímpico de Oregon.	1.1	0:00:25	Más tarde, Schott trabajó como subdirector del club de fúltol Tualatin Hills United y fue entrenador como parte del Programa de Desarrollo Olímpico de Oregon.	19.230769230769237
es	mtgen_a	professional	950	M	Ro has enjoyed an extensive career as an athlete and as a professional trainer.	Ro ha disfrutado de una amplia carrera como atleta y entrenador profesional.	14	0	Ro ha disfrutado de una extensa carrera como deportista y como entrenador profesional.	0.0	0:00:00	Ro ha disfrutado de una extensa carrera como deportista y como entrenador profesional.	0.0
es	mtgen_a	professional	954	M	Crowds and analysts were impressed with the young athlete's exceptional difficulty.	La excepcional dificultad del joven atleta impresionó a la multitud y a los analistas.	11	0	El público y los analistas quedaron impresionados por la excepcional dificultad del joven atleta.	0.0	0:00:00	El público y los analistas quedaron impresionados por la excepcional dificultad del joven atleta.	0.0
es	mtgen_a	professional	727	M	Failure to do so may lead to legal action against the physician.	No hacerlo puede conllevar acciones legales contra el médico.	12	0	No hacerlo puede dar lugar a acciones legales contra el médico.	0.0	0:00:00	No hacerlo puede dar lugar a acciones legales contra el médico.	0.0
es	mtgen_a	professional	699	M	After a short recovery at the doctor's office (usually less than an hour), the patient is sent home to rest.	Tras una breve recuperación en la consulta del doctor (normalmente menos de una hora), mandan al paciente a casa a descansar.	20	0	Después de una breve recuperación en el consultorio del médico (generalmente menos de una hora), se envía al paciente a casa para que descanse.	0.0	0:00:00	Después de una breve recuperación en el consultorio del médico (generalmente menos de una hora), se envía al paciente a casa para que descanse.	0.0
es	mtgen_a	professional	1066	M	D'Istria was also a painter.	D'Istria también fue pintor.	6	0	D'Istria también fue pintor.	0.0	0:00:00	D'Istria también fue pintor.	0.0
es	mtgen_a	professional	887	M	Sutcliffe is an internationally recognised wine writer and renowned taster and writes regularly for many international publications.	Sutcliffe es un escritor de vinos reconocido internacionalmente y un renombrado catador y escribe regularmente para muchas publicaciones internacionales.	17	0	Sutcliffe es un escritor de vinos reconocido internacionalmente y un catador de renombre y escribe regularmente para muchas publicaciones internacionales.	0.0	0:00:00	Sutcliffe es un escritor de vinos reconocido internacionalmente y un catador de renombre y escribe regularmente para muchas publicaciones internacionales.	0.0
es	mtgen_a	professional	557	M	Being able to create margins, headings and page numbers on the fly, Koss was the first programmer to attempt computer based word processing.	Al poder crear márgenes, encabezados y números de página sobre la marcha, Koss fue el primer programador que intentó el procesamiento de texto por ordenador.	23	0	Al poder crear márgenes, encabezados y números de página sobre la marcha, Koss fue el primer programador en intentar el procesamiento de textos por computadora.	0.0	0:00:00	Al poder crear márgenes, encabezados y números de página sobre la marcha, Koss fue el primer programador en intentar el procesamiento de textos por computadora.	0.0
es	mtgen_a	professional	1030	M	A gifted athlete, Heaney also played Gaelic football, soccer, fastball and in-line hockey.	Un atleta talentoso, Heaney también jugó fútbol gaélico, fútbol, bola rápida y hockey en línea.	13	0	Heaney, un atleta talentoso, también jugó fútbol gaélico, fútbol, bola rápida y hockey en línea.	0.0	0:00:00	Heaney, un atleta talentoso, también jugó fútbol gaélico, fútbol, bola rápida y hockey en línea.	0.0
es	mtgen_a	professional	895	M	Glidden worked as an employment and civil rights lawyer for over a decade.	Glidden trabajó como abogado laboral y de derechos civiles durante más de una década.	13	0	Glidden trabajó como abogado laboral y de derechos civiles durante más de una década.	0.0	0:00:00	Glidden trabajó como abogado laboral y de derechos civiles durante más de una década.	0.0
es	mtgen_a	professional	629	M	As a career lawyer, MacMillan joined Canadian National Railways in 1937 as a solicitor in the company's Winnipeg, Manitoba office.	Como abogado de profesión, MacMillan se unió a Canadian National Railways en 1937 como abogado en la oficina de la compañía en Manitoba, Winnipeg.	20	0	Como abogado de carrera, MacMillan se incorporó a Canadian National Railways en 1937 como abogado en la oficina de la empresa en Winnipeg, Manitoba.	0.0	0:00:00	Como abogado de carrera, MacMillan se incorporó a Canadian National Railways en 1937 como abogado en la oficina de la empresa en Winnipeg, Manitoba.	0.0
es	mtgen_a	professional	1096	M	Five years later, Beisiegel qualified as a level C-4 professor and became director of the Institute of Biochemistry and Molecular Biology at the University Medical Center Hamburg-Eppendorf.	Cinco años después, Beisiegel sacó el título de profesor de nivel C-4 y llegó a ser el director del Instituto de Bioquímica y Biología Molecular en el Centro Médico de la Universidad de Hamburg-Eppendorf.	28	0	Cinco años más tarde, Beisiegel obtuvo el título de profesor de nivel C-4 y se convirtió en director del Instituto de Bioquímica y Biología Molecular del Centro Médico Universitario de Hamburgo-Eppendorf.	0.0	0:00:00	Cinco años más tarde, Beisiegel obtuvo el título de profesor de nivel C-4 y se convirtió en director del Instituto de Bioquímica y Biología Molecular del Centro Médico Universitario de Hamburgo-Eppendorf.	0.0
es	mtgen_a	professional	906	M	This is the only essay in Partial Portraits on a writer of minor significance, and it has provided grist to the mill of biographical speculation.	Este es el único artículo en Partial Portraits de un escritor de poca importancia, y ha sido muy provechoso para la especulación biográfica.	25	0	Este es el único ensayo de Partial Portraits sobre un escritor de menor importancia, y ha aportado agua al molino de la especulación biográfica.	0.0	0:00:00	Este es el único ensayo de Partial Portraits sobre un escritor de menor importancia, y ha aportado agua al molino de la especulación biográfica.	0.0
es	mtgen_a	professional	818	M	Struth moved to Rangers in 1914 to take up the position of assistant manager.	Struth se fue a los Rangers en 1914 para ocupar el puesto de técnico asistente.	14	96273	Struth se mudó a los Rangers en 1914 para ocupar el puesto de subdirector.	6.9	0:01:36	Struth se trasladó a los Rangers en 1914 para ocupar el puesto de segundo entrenador.	20.0
es	mtgen_a	professional	584	M	Johansson became Creative Advisor in 2015, and has subsequently worked as H&amp;M's spokesperson and representative.	Johansson llegó al puesto de asesor creativo en 2015 y después ha trabajado como portavoz y representante de H&M.	16	0	Johansson se convirtió en asesor creativo en 2015 y posteriormente trabajó como portavoz y representante de H&amp;M.	0.0	0:00:00	Johansson se convirtió en asesor creativo en 2015 y posteriormente trabajó como portavoz y representante de H&amp;M.	0.0
es	mtgen_a	professional	651	M	Therefore, the witch doctor come up with a task of bringing the rain.	Por lo tanto, al médico brujo se le ocurre la tarea de traer la lluvia.	13	0	Por lo tanto, al médico brujo se le ocurrió la tarea de traer la lluvia.	0.0	0:00:00	Por lo tanto, al médico brujo se le ocurrió la tarea de traer la lluvia.	0.0
es	mtgen_a	professional	665	M	Nishizawa was a painter, engraver, graphic artist, sketch artist and ceramicist.	Nishizawa fue pintor, grabador, artista gráfico, dibujante y ceramista.	11	0	Nishizawa fue pintor, grabador, artista gráfico, dibujante y ceramista.	0.0	0:00:00	Nishizawa fue pintor, grabador, artista gráfico, dibujante y ceramista.	0.0
es	mtgen_a	professional	990	M	Crouch was elected Vanderburgh County Auditor in 1994.	Crouch fue elegido auditor del Condado de Vanderburgh en 1994.	8	0	Crouch fue elegido auditor del condado de Vanderburgh en 1994.	0.0	0:00:00	Crouch fue elegido auditor del condado de Vanderburgh en 1994.	0.0
es	mtgen_a	professional	831	M	Professor Shonku is a polyglot who knows 69 languages.	El profesor Shonku es un políglota que conoce 69 idiomas.	9	0	El profesor Shonku es un políglota que conoce 69 idiomas.	0.0	0:00:00	El profesor Shonku es un políglota que conoce 69 idiomas.	0.0
es	mtgen_a	professional	910	M	For the next five years, Skocpol would serve as an Associate Professor of Sociology and Political Science, and of Social Science, Professor of Sociology and Political Science, and Director for the Center for the Study of Industrial Societies.	Durante los siguientes 5 años, Skocpol ejerció como profesor asociado de Sociología y Ciencias Políticas, y de Ciencias Sociales, y fue profesor de Sociología y Ciencias Políticas, y director del Centro para el Estudio de Sociedades Industriales.	38	0	Durante los siguientes cinco años, Skocpol se desempeñaría como profesor asociado de Sociología y Ciencias Políticas y de Ciencias Sociales, profesor de Sociología y Ciencias Políticas y director del Centro para el Estudio de Sociedades Industriales.	0.0	0:00:00	Durante los siguientes cinco años, Skocpol se desempeñaría como profesor asociado de Sociología y Ciencias Políticas y de Ciencias Sociales, profesor de Sociología y Ciencias Políticas y director del Centro para el Estudio de Sociedades Industriales.	0.0
es	mtgen_a	professional	453	M	Parsons also served as Cultural Officer from 1984-1989 and has been active in culture and sports.	Parsons también ejerció como responsable de cultura de 1984 a 1989 y ha estado activo en cultura y deporte.	18	0	Parsons también se desempeñó como Oficial Cultural de 1984 a 1989 y ha estado activo en la cultura y los deportes.	0.0	0:00:00	Parsons también se desempeñó como Oficial Cultural de 1984 a 1989 y ha estado activo en la cultura y los deportes.	0.0
es	mtgen_a	professional	946	M	The doctor and some of the patients had signed off to purchase it.	El doctor y algunos de los pacientes se habían apuntado para comprarlo.	13	0	El médico y algunos de los pacientes habían autorizado su compra.	0.0	0:00:00	El médico y algunos de los pacientes habían autorizado su compra.	0.0
es	mtgen_a	professional	659	M	The professor translates a mysterious message written in blood on a wall that uses a forgotten dialect of Old Romanian or Old Slavonic.	El profesor traduce un misterioso mensaje escrito con sangre en la pared, que usa un dialecto olvidado de antiguo rumano o eslavo antiguo.	23	0	El profesor traduce un misterioso mensaje escrito con sangre en una pared que utiliza un dialecto olvidado del antiguo rumano o del antiguo eslavo.	0.0	0:00:00	El profesor traduce un misterioso mensaje escrito con sangre en una pared que utiliza un dialecto olvidado del antiguo rumano o del antiguo eslavo.	0.0
es	mtgen_a	professional	671	M	While questioning a witness, the magistrate would look closely for five kinds of behavior: the person's statements, expression, breathing, reaction to the words of the judge, and eyes.	Al interrogar a un sospechoso, el magistrado buscaba cinco tipos de comportamiento: la declaración de la persona, expresión, respiración, reacción a las palabras del juez y los ojos.	28	0	Al interrogar a un testigo, el magistrado observaba de cerca cinco tipos de comportamiento: las declaraciones de la persona, su expresión, su respiración, su reacción a las palabras del juez y sus ojos.	0.0	0:00:00	Al interrogar a un testigo, el magistrado observaba de cerca cinco tipos de comportamiento: las declaraciones de la persona, su expresión, su respiración, su reacción a las palabras del juez y sus ojos.	0.0
es	mtgen_a	professional	840	M	Masterson, editor, which in appearance is very neat and tidy.	Masterson, editor, que aparenta ser pulcro y ordenado.	10	0	Masterson, editor, que en apariencia es muy limpio y ordenado.	0.0	0:00:00	Masterson, editor, que en apariencia es muy limpio y ordenado.	0.0
es	mtgen_a	professional	477	M	At Microbyte, Bestwick was promoted time and time again, eventually becoming promotions manager and later sales manager.	En Microbyte, Bestwick fue ascendido una y otra vez, y llegó a ser director de promociones y después, director de ventas.	17	0	En Microbyte, Bestwick fue ascendido una y otra vez y finalmente se convirtió en gerente de promociones y más tarde en gerente de ventas.	0.0	0:00:00	En Microbyte, Bestwick fue ascendido una y otra vez y finalmente se convirtió en gerente de promociones y más tarde en gerente de ventas.	0.0
es	mtgen_a	professional	1028	M	Survilla has participated in more than 30 exhibitions as a painter.	Survilla ha participado en más de 30 exhibiciones como pintor.	11	0	Survilla ha participado en más de 30 exposiciones como pintor.	0.0	0:00:00	Survilla ha participado en más de 30 exposiciones como pintor.	0.0
es	mtgen_a	professional	923	M	Funded using crowdfunding platform Planeta.ru, Colta.ru guaranteed Stepanova more editorial freedom as editor-in-chief.	Financiada mediante la plataforma de crowdfunding Planeta.ru, Colta.ru le garantizó a Stepanova más libertad editorial como editor en jefe.	15	27347	Colta.ru, financiado mediante la plataforma de financiación colectiva Planeta.ru, garantizó a Stepanova más libertad editorial como editora en jefe.	1.8	0:00:27	Colta.ru, financiado mediante la plataforma de financiación colectiva Planeta.ru, garantizó a Stepánova más libertad editorial como editor en jefe.	7.6923076923076925
es	mtgen_a	professional	625	M	Oliphant left the Cavendish Laboratory in 1937 to become the Poynting Professor of Physics at the University of Birmingham.	Oliphant dejó el laboratorio Cavendish en 1937 para ser profesor de Poynting de Física en la Universidad de Birmingham.	19	44543	Oliphant dejó el Laboratorio Cavendish en 1937 para convertirse en Profesor Poynting de Física en la Universidad de Birmingham.	2.3	0:00:45	Oliphant dejó el Laboratorio Cavendish en 1937 para convertirse en el profesor Poynting de Física en la Universidad de Birmingham.	10.0
es	mtgen_a	professional	447	M	Pettersson is the chief scientist of the Commission's research vessel fleet.	Pattersson es el científico principal de la flota de navíos de investigación de la Comisión.	11	0	Pettersson es el científico jefe de la flota de buques de investigación de la Comisión.	0.0	0:00:00	Pettersson es el científico jefe de la flota de buques de investigación de la Comisión.	0.0
es	mtgen_a	professional	502	M	The image of a WAAC officer candidate (at right) comes from this shoot.	La imagen de un candidato a agente de WAAC (a la derecha) viene en esta toma.	13	0	La imagen de un candidato a oficial de WAAC (a la derecha) proviene de esta sesión.	0.0	0:00:00	La imagen de un candidato a oficial de WAAC (a la derecha) proviene de esta sesión.	0.0
es	mtgen_a	professional	518	M	Vaid is CEO of the Vaid Group LLC, which works with social justice innovators, movements and organizations to address structural inequalities based on sexual orientation, gender identity, race, gender and economic status.	Vaid es el consejero delegado de Vaid Group LLC, que trabaja con innovadores, movimientos y organizaciones de justicia social para tratar con los inequilibrios estructurales según la orientación sexual, la identidad de género, raza, género y estado económico.	32	0	Vaid es director ejecutivo de Vaid Group LLC, que trabaja con innovadores, movimientos y organizaciones de justicia social para abordar las desigualdades estructurales basadas en la orientación sexual, la identidad de género, la raza, el género y la situación económica.	0.0	0:00:00	Vaid es director ejecutivo de Vaid Group LLC, que trabaja con innovadores, movimientos y organizaciones de justicia social para abordar las desigualdades estructurales basadas en la orientación sexual, la identidad de género, la raza, el género y la situación económica.	0.0
es	mtgen_a	professional	608	M	Tikhonov worked as an assistant engineer from 1924 to 1926.	Tikhonov trabajó como ingeniero adjunto de 1924 a 1926.	10	0	Tikhonov trabajó como asistente de ingeniería de 1924 a 1926.	0.0	0:00:00	Tikhonov trabajó como asistente de ingeniería de 1924 a 1926.	0.0
es	mtgen_a	professional	721	M	Before becoming a writer, Kuznetsov studied ballet and acting, tried painting and music, worked as a carpenter, road builder, concrete worker, helped build the Kakhovka hydroelectric power plant on the Dniper river, and worked on the Irkutsk and Bratsk hydroelectric power plants in Siberia.	Antes de ser escritor Kuznetsov estudió ballet y actuación, probó la pintura y la música, trabajó como carpintero, constructor de carretera, armador de hormigón, ayudó a construir la central hidroélectrica Kakhovka en el río Dniéper, y trabajó en las centrales hidroeléctricas de Irkutsk y Bratsk en Siberia.	44	95748	Antes de convertirse en escritor, Kuznetsov estudió ballet y actuación, probó la pintura y la música, trabajó como carpintero, constructor de carreteras, albañil, ayudó a construir la central hidroeléctrica de Kakhovka en el río Dniper y trabajó en las centrales hidroeléctricas de Irkutsk y Bratsk en Siberia.	2.2	0:01:36	Antes de convertirse en escritor, Kuznetsov estudió balé y actuación, probó la pintura y la música, trabajó como carpintero, constructor de carreteras y albañil, ayudó a construir la central hidroeléctrica de Kajovka en el río Dniéper y trabajó en las centrales hidroeléctricas de Irkutsk y Bratsk en Siberia.	7.4074074074074066
es	mtgen_a	professional	793	M	By the end of World War II, Assistant Commissioner A (Operations and Administration) was responsible for all uniformed police, including specialist units, except traffic police, which were under Assistant Commissioner B (Traffic).	Al final de la Segunda Guerra Mundial, el subcomisario A (operaciones y administración) era responsable de toda la policía uniformada, incluidas las unidades especializadas, excepto la policía de tráfico, que dependía del subcomisario B (tráfico).	32	0	Al final de la Segunda Guerra Mundial, el Comisionado Adjunto A (Operaciones y Administración) era responsable de toda la policía uniformada, incluidas las unidades especializadas, excepto la policía de tránsito, que estaba bajo el Comisionado Adjunto B (Tráfico).	0.0	0:00:00	Al final de la Segunda Guerra Mundial, el Comisionado Adjunto A (Operaciones y Administración) era responsable de toda la policía uniformada, incluidas las unidades especializadas, excepto la policía de tránsito, que estaba bajo el Comisionado Adjunto B (Tráfico).	0.0
es	mtgen_a	professional	1018	M	Within the production company, Grammer has worked as a creator, writer and executive producer.	En la empresa productora Grammer ha trabajado como creador, escritor y productor ejecutivo.	14	0	Dentro de la productora, Grammer ha trabajado como creador, escritor y productor ejecutivo.	0.0	0:00:00	Dentro de la productora, Grammer ha trabajado como creador, escritor y productor ejecutivo.	0.0
es	mtgen_a	professional	382	M	During World War I, Zoshchenko served in the army as a field officer, was wounded in action several times, and was heavily decorated.	Durante la Primera Guerra Mundial, Zoshchenko sirvió en el ejército como oficial de campo, fue herido en combate en varias ocasiones y fue altamente condecorado.	23	0	Durante la Primera Guerra Mundial, Zoshchenko sirvió en el ejército como oficial de campo, fue herido en combate varias veces y recibió numerosas condecoraciones.	0.0	0:00:00	Durante la Primera Guerra Mundial, Zoshchenko sirvió en el ejército como oficial de campo, fue herido en combate varias veces y recibió numerosas condecoraciones.	0.0
es	mtgen_a	professional	304	M	Souphanouvong became commander in chief, as well as minister of foreign affairs.	Souphanouvong se convirtió en comandante en jefe y en ministro de Asuntos Exteriores.	12	0	Souphanouvong se convirtió en comandante en jefe y ministro de Asuntos Exteriores.	0.0	0:00:00	Souphanouvong se convirtió en comandante en jefe y ministro de Asuntos Exteriores.	0.0
es	mtgen_a	professional	601	M	Nattier aspired to be a history painter.	Nattier aspiraba a ser un pintor histórico.	7	31207	Nattier aspiraba a ser pintor de historia.	4.5	0:00:31	Nattier aspiraba a ser pintor histórico.	25.0
es	mtgen_a	professional	533	M	Work (composer), role, conductor, year of recording, label.	Trabajo (compositor), papel, director, año de grabación, sello.	8	0	Obra (compositor), rol, director de orquesta, año de grabación, sello.	0.0	0:00:00	Obra (compositor), rol, director de orquesta, año de grabación, sello.	0.0
es	mtgen_a	professional	374	M	Pilous would be coach &amp; general manager of the team, and MacDonald would be secretary &amp; treasurer.	Pilous sería el entrenador y el gerente general del equipo, y MacDonald sería el secretario y tesorero.	15	0	Pilous sería el entrenador y director general del equipo, y MacDonald sería el secretario y tesorero.	0.0	0:00:00	Pilous sería el entrenador y director general del equipo, y MacDonald sería el secretario y tesorero.	0.0
es	mtgen_a	professional	265	M	Though the story hardly strays from the focus of the four first-year classes labeled 1-A through 1-D, the mishaps that occur in them, the teacher's lounge, and on school trips also become sources of material for topical allusions regarding satire, anime, Internet, gaming, and popular culture.	A pesar de que la historia apenas se desvía del foco de las cuatro clases de primer año, marcadas de 1-A a 1D, los percances que ocurren en ellas, el salón del profesor y en las excursiones escolares también se convierten en fuentes de material para alusiones tópicas que aluden a la sátira, el anime, internet, los videojuegos y la cultura popular.	48	173978	Aunque la historia apenas se desvía del enfoque de las cuatro clases de primer año etiquetadas del 1-A al 1-D, los percances que ocurren en ellas, en la sala de profesores y en los viajes escolares también se convierten en fuentes de material para alusiones actuales sobre la sátira, anime, Internet, juegos y cultura popular.	3.6	0:02:54	Aunque la historia apenas se desvía del enfoque de las cuatro clases de primer año etiquetadas del 1-A al 1-D, los percances que ocurren en ellas, en la sala de profesores y en los viajes escolares también se convierten en fuentes de material para alusiones tópicas sobre la sátira, el anime, Internet, los juegos y la cultura popular.	6.153846153846154
es	mtgen_a	professional	187	M	There are assumptions such as that every house would have, at least, a housekeeper and multiple children.	Hay suposiciones tales como que cada casa tendría, al menos, un casero y varios niños.	17	101921	Hay suposiciones como que cada casa tendría, al menos, un ama de llaves y varios hijos.	6.0	0:01:42	Hay suposiciones como que cada casa tendría, al menos, un mayordomo y varios hijos.	15.789473684210526
es	mtgen_a	professional	270	M	Kahane is the author of Passions of the Voice, a study of narrative and the strategies of hysteric discourse.	Kahane es el autor de Passions of the Voice, un estudio de narrativa y estrategias de discurso histérico.	19	0	Kahane es autor de Passions of the Voice, un estudio sobre la narrativa y las estrategias del discurso histérico.	0.0	0:00:00	Kahane es autor de Passions of the Voice, un estudio sobre la narrativa y las estrategias del discurso histérico.	0.0
es	mtgen_a	professional	623	M	Hevia, who was also a surgeon, had been the first Cuban national to graduate from the United States Naval Academy at Annapolis, as a member of the Class of 1920.	Hevia, quien era también cirujano, había sido el primer nacional Cubano en graduarse en la Academia Naval en Annapolis de los estados Unidos, como miembro de la clase de 1920.	30	0	Hevia, que también era cirujano, había sido el primer ciudadano cubano en graduarse de la Academia Naval de los Estados Unidos en Annapolis, como miembro de la promoción de 1920.	0.0	0:00:00	Hevia, que también era cirujano, había sido el primer ciudadano cubano en graduarse de la Academia Naval de los Estados Unidos en Annapolis, como miembro de la promoción de 1920.	0.0
es	mtgen_a	professional	914	M	The writer expanded the story by both fleshing out each character and allowing room for new musical numbers.	El escritor expandió la historia, tanto desgranando cada personaje como haciendo hueco para números musicales nuevos.	18	23782	El escritor amplió la historia dando cuerpo a cada personaje y dejando espacio para nuevos números musicales.	1.3	0:00:24	El escritor amplió la historia aportando complejidad a cada personaje y dejando espacio para nuevos números musicales.	11.11111111111111
