lang	dataset	user_type	original_id	gender	segment	tgt	raw_word_count	time_to_edit	suggestion	secs_per_word	parsed_time_to_edit	last_translation	HTER
es	mtgen_a	professional	721	F	Before becoming a writer, Kuznetsov studied ballet and acting, tried painting and music, worked as a carpenter, road builder, concrete worker, helped build the Kakhovka hydroelectric power plant on the Dniper river, and worked on the Irkutsk and Bratsk hydroelectric power plants in Siberia.	Antes de ser escritora Kuznetsov estudió ballet y actuación, probó la pintura y la música, trabajó como carpintera, constructora de carretera, armadora de hormigón, ayudó a construir la central hidroélectrica Kakhovka en el río Dniéper, y trabajó en las centrales hidroeléctricas de Irkutsk y Bratsk en Siberia.	44	13827	Antes de convertirse en escritor, Kuznetsov estudió ballet y actuación, probó la pintura y la música, trabajó como carpintero, constructor de carreteras, albañil, ayudó a construir la central hidroeléctrica de Kakhovka en el río Dniper y trabajó en las centrales hidroeléctricas de Irkutsk y Bratsk en Siberia.	0.3	0:00:14	Antes de convertirse en escritora, Kuznetsov estudió ballet y actuación, probó la pintura y la música, trabajó como carpintera, constructora de carreteras, albañila, ayudó a construir la central hidroeléctrica de Kakhovka en el río Dniper y trabajó en las centrales hidroeléctricas de Irkutsk y Bratsk en Siberia.	7.407407407
es	mtgen_a	professional	793	F	By the end of World War II, Assistant Commissioner A (Operations and Administration) was responsible for all uniformed police, including specialist units, except traffic police, which were under Assistant Commissioner B (Traffic).	Al final de la Segunda Guerra Mundial, la subcomisaria A (operaciones y administración) era responsable de toda la policía uniformada, incluidas las unidades especializadas, excepto la policía de tráfico, que dependía de la subcomisaria B (tráfico).	32	48218	Al final de la Segunda Guerra Mundial, el Comisionado Adjunto A (Operaciones y Administración) era responsable de toda la policía uniformada, incluidas las unidades especializadas, excepto la policía de tránsito, que estaba bajo el Comisionado Adjunto B (Tráfico).	1.5	0:00:48	Al final de la Segunda Guerra Mundial, la Comisionada Adjunta A (Operaciones y Administración) era responsable de toda la policía uniformada, incluidas las unidades especializadas, excepto la policía de tránsito, que estaba bajo la Comisionada Adjunta B (Tráfico).	12.76595745
es	mtgen_a	professional	1018	F	Within the production company, Grammer has worked as a creator, writer and executive producer.	En la empresa productora Grammer ha trabajado como creadora, escritora y productora ejecutiva.	14	14071	Dentro de la productora, Grammer ha trabajado como creador, escritor y productor ejecutivo.	1.0	0:00:15	Dentro de la productora, Grammer ha trabajado como creadora, escritora y productora ejecutiva.	25.0
es	mtgen_a	professional	382	F	During World War I, Zoshchenko served in the army as a field officer, was wounded in action several times, and was heavily decorated.	Durante la Primera Guerra Mundial, Zoshchenko sirvió en el ejército como oficiala de campo, fue herida en combate en varias ocasiones y fue altamente condecorada.	23	9798	Durante la Primera Guerra Mundial, Zoshchenko sirvió en el ejército como oficial de campo, fue herido en combate varias veces y recibió numerosas condecoraciones.	0.4	0:00:10	Durante la Primera Guerra Mundial, Zoshchenko sirvió en el ejército como oficial de campo, fue herida en combate varias veces y recibió numerosas condecoraciones.	3.703703704
es	mtgen_a	professional	304	F	Souphanouvong became commander in chief, as well as minister of foreign affairs.	Souphanouvong se convirtió en comandante en jefe y en ministra de Asuntos Exteriores.	12	12935	Souphanouvong se convirtió en comandante en jefe y ministro de Asuntos Exteriores.	1.1	0:00:13	Souphanouvong se convirtió en comandante en jefe y ministra de Asuntos Exteriores.	7.692307692
es	mtgen_a	professional	601	F	Nattier aspired to be a history painter.	Nattier aspiraba a ser una pintora histórica.	7	41214	Nattier aspiraba a ser pintor de historia.	5.9	0:00:41	Nattier aspiraba a ser pintora de historia.	12.5
es	mtgen_a	professional	533	F	Work (composer), role, conductor, year of recording, label.	Trabajo (compositora), papel, directora, año de grabación, sello.	8	15304	Obra (compositor), rol, director de orquesta, año de grabación, sello.	1.9	0:00:15	Obra (compositora), rol, directora de orquesta, año de grabación, sello.	11.76470588
es	mtgen_a	professional	374	F	Pilous would be coach &amp; general manager of the team, and MacDonald would be secretary &amp; treasurer.	Pilous sería el entrenador y el gerente general del equipo, y MacDonald sería la secretaria y tesorera.	15	20861	Pilous sería el entrenador y director general del equipo, y MacDonald sería el secretario y tesorero.	1.4	0:00:21	Pilous sería la entrenadora y directora general del equipo, y MacDonald sería la secretaria y tesorera.	33.33333333
es	mtgen_a	professional	265	F	Though the story hardly strays from the focus of the four first-year classes labeled 1-A through 1-D, the mishaps that occur in them, the teacher's lounge, and on school trips also become sources of material for topical allusions regarding satire, anime, Internet, gaming, and popular culture.	A pesar de que la historia apenas se desvía del foco de las cuatro clases de primer año, marcadas de 1-A a 1D, los percances que ocurren en ellas, el salón de la profesora y en las excursiones escolares también se convierten en fuentes de material para alusiones tópicas que aluden a la sátira, el anime, internet, los videojuegos y la cultura popular.	48	35182	Aunque la historia apenas se desvía del enfoque de las cuatro clases de primer año etiquetadas del 1-A al 1-D, los percances que ocurren en ellas, en la sala de profesores y en los viajes escolares también se convierten en fuentes de material para alusiones actuales sobre la sátira, anime, Internet, juegos y cultura popular.	0.7	0:00:35	Aunque la historia apenas se desvía del tema central de las cuatro clases de primer curso etiquetadas del 1-A al 1-D, los percances que ocurren en ellas, en la sala de profesoras y en las excursiones escolares también se convierten en fuentes de material para alusiones de actualidad sobre la sátira, el anime, Internet, los juegos y la cultura popular.	16.92307692
es	mtgen_a	professional	187	F	There are assumptions such as that every house would have, at least, a housekeeper and multiple children.	Hay suposiciones tales como que cada casa tendría, al menos, una ama de llaves y varias niñas.	17	41938	Hay suposiciones como que cada casa tendría, al menos, un ama de llaves y varios hijos.	2.5	0:00:42	Hay suposiciones como que cada casa tendría, al menos, un ama de llaves y varias hijas.	10.52631579
es	mtgen_a	professional	270	F	Kahane is the author of Passions of the Voice, a study of narrative and the strategies of hysteric discourse.	Kahane es la autora de Passions of the Voice, un estudio de narrativa y estrategias de discurso histérico.	19	7164	Kahane es autor de Passions of the Voice, un estudio sobre la narrativa y las estrategias del discurso histérico.	0.4	0:00:07	Kahane es la autora de Passions of the Voice, un estudio sobre la narrativa y las estrategias del discurso histérico.	9.523809524
es	mtgen_a	professional	623	F	Hevia, who was also a surgeon, had been the first Cuban national to graduate from the United States Naval Academy at Annapolis, as a member of the Class of 1920.	Hevia, quien era también cirujana, había sido la primer nacional Cubana en graduarse en la Academia Naval en Annapolis de los estados Unidos, como miembro de la clase de 1920.	30	19301	Hevia, que también era cirujano, había sido el primer ciudadano cubano en graduarse de la Academia Naval de los Estados Unidos en Annapolis, como miembro de la promoción de 1920.	0.6	0:00:19	Hevia, que también era cirujana, había sido la primera ciudadana cubana en graduarse de la Academia Naval de los Estados Unidos en Annapolis, como miembro de la promoción de 1920.	14.70588235
es	mtgen_a	professional	914	F	The writer expanded the story by both fleshing out each character and allowing room for new musical numbers.	La escritora expandió la historia, tanto desgranando cada personaje como haciendo hueco para números musicales nuevos.	18	10533	El escritor amplió la historia dando cuerpo a cada personaje y dejando espacio para nuevos números musicales.	0.6	0:00:11	La escritora amplió la historia dando cuerpo a cada personaje y dejando espacio para nuevos números musicales.	11.11111111
es	mtgen_a	professional	898	F	The crowd pleasing athlete placed 4th at the 1992 Olympic trials and was awarded a place on the United States Olympic team.	La irresistible atleta se ubicó en el 4o lugar en las pruebas Olímpicas en 1992 y se ganó un lugar en el Equipo Olímpico de los Estados Unidos.	22	30835	El atleta que complació al público quedó en cuarto lugar en las pruebas olímpicas de 1992 y obtuvo un lugar en el equipo olímpico de Estados Unidos.	1.4	0:00:31	Esta atleta, muy popular, fue 4.ª en las pruebas olímpicas de 1992 y consiguió una plaza en el equipo olímpico de Estados Unidos.	42.85714286
es	mtgen_a	professional	58	F	It is based on a contemporaneous diary of events kept by the author from 1990 to 1996 while employed by GPA and subsequently GECAS.	Está basado en un diario de eventos de un contemporáneo guardado por la autora de 1990 a 1996 mientras esta empleada por GPA y subsecuentemente GECAS.	24	27014	Se basa en un diario contemporáneo de acontecimientos llevado por el autor de 1990 a 1996 mientras trabajaba para GPA y posteriormente para GECAS.	1.1	0:00:27	Se basa en un diario contemporáneo de acontecimientos llevado por la autora de 1990 a 1996 mientras trabajaba para GPA y posteriormente para GECAS.	8.0
es	mtgen_a	professional	426	F	Spielberg says that the effect of not seeing the driver makes the real villain of the film the truck itself, rather than the driver.	Spielberg dice que el efecto de no ver a la conductora hace que el verdadero villano de la película sea el camión en sí, en vez de la conductora.	24	49796	Spielberg dice que el efecto de no ver al conductor convierte al verdadero villano de la película en el camión, en lugar del conductor.	2.1	0:00:50	Spielberg dice que el efecto de no ver a la conductora convierte al propio camión en el verdadero villano de la película, en lugar de a la conductora.	38.46153846
es	mtgen_a	professional	390	F	The other driver was seriously injured.	La otra conductora fue gravemente herida.	6	16295	El otro conductor resultó gravemente herido.	2.7	0:00:16	La otra conductora resultó gravemente herida.	57.14285714
es	mtgen_a	professional	56	F	Vaiko is now the general secretary of the MDMK party.	Vaiko es ahora la secretaria general del partido MDMK.	10	0	Vaiko es ahora la secretaria general del partido MDMK.	0.0	0:00:00	Vaiko es ahora la secretaria general del partido MDMK.	0.0
es	mtgen_a	professional	722	F	Luff had become perhaps the most prolific philatelic writer of the age, with works ranging from the tutorial What Philately Teaches Us (1899) to the classic reference work The Postage Stamps of the United States (1902), and numerous articles in the AJP and Mekeel's Weekly Stamp News.	"Luff se había convertido quizás en la escritora filatélica más prolífica de la época, con obras que abarcaban desde el tutorial ""What Philately Teaches Us"" (1899) hasta la obra de referecia clásica ""The Postage Stamps of the United States"" (1902) y numerosos artículos en AJP y Mekeel's Weekly Stamp News."	47	60442	Luff se había convertido quizás en el escritor filatélico más prolífico de la época, con obras que iban desde el tutorial What Philately Teaches Us (1899) hasta la obra de referencia clásica The Postage Stamps of the United States (1902), y numerosos artículos en el AJP y Mekeel. Noticias semanales de sellos.	1.3	0:01:00	Luff se había convertido quizás en la escritora filatélica más prolífica de la época, con obras que iban desde el tutorial What Philately Teaches Us (1899) hasta la obra de referencia clásica The Postage Stamps of the United States (1902) y numerosos artículos en el AJP y Mekeel: Noticias semanales de sellos.	10.0
es	mtgen_a	professional	74	F	The first incident involved Seligman's declining the post of Secretary of the Treasury.	El primer incidente implicó que Seligman declinara el puesto de Secretaria del Tesoro.	13	17945	El primer incidente implicó que Seligman rechazara el puesto de Secretario del Tesoro.	1.4	0:00:18	El primer incidente implicó que Seligman rechazara el puesto de secretaria del Tesoro.	7.142857143
es	mtgen_a	professional	444	F	The firm in which Hayek was CEO, split into two entities in 2006 following Hayek's departure to join the Lebanese Government under Prime Minister Siniora.	El despacho en el cual Hayek era la CEO se dividió en dos entidades en 2006, después de la salida de Hayek para unirse al Gobierno libanés a cargo del Primer Ministro Siniora.	25	28874	La empresa en la que Hayek era director ejecutivo se dividió en dos entidades en 2006 tras la salida de Hayek para unirse al gobierno libanés bajo el primer ministro Siniora.	1.2	0:00:29	La empresa en la que Hayek era directora ejecutiva se dividió en dos entidades en 2006, tras la salida de Hayek para unirse al Gobierno libanés bajo la primera ministra Siniora.	21.875
es	mtgen_a	professional	238	F	This book was the result of ten years of researching the life of the photographer and political activist.	Este libro es el resultado de diez años de investigación de la vida de la fotógrafa y activista política.	18	10920	Este libro fue el resultado de diez años de investigación sobre la vida del fotógrafo y activista político.	0.6	0:00:11	Este libro fue el resultado de diez años de investigación sobre la vida de la fotógrafa y activista política.	21.05263158
es	mtgen_a	professional	164	F	The artist uses illusion techniques to re-appear unharmed.	La artista usa técnicas de espejismo para reaparecer ilesa.	8	20002	El artista utiliza técnicas de ilusión para reaparecer ileso.	2.5	0:00:20	La artista utiliza técnicas ilusionistas para reaparecer ilesa.	40.0
es	mtgen_a	professional	328	F	After graduating the university, from 1927 to 1930 D. Ivanenko was a scholarship student and then a research scientist at the Physical Mathematical Institute of Academy of Sciences of USSR.	Tras graduarse en la universidad, de 1927 a 1939, la Sra. Ivanenko fue una estudiante becada y, después, científica investigadora en el Instituto de Física y Matemáticas de la Academia de Ciencias de la URSS.	30	31726	Después de graduarse en la universidad, de 1927 a 1930 D. Ivanenko fue estudiante becado y luego científico investigador en el Instituto Físico-Matemático de la Academia de Ciencias de la URSS.	1.1	0:00:32	Después de graduarse en la universidad, de 1927 a 1930 D. Ivanenko fue estudiante becada y luego científica investigadora en el Instituto Físico-Matemático de la Academia de Ciencias de la URSS.	8.823529412
es	mtgen_a	professional	96	F	The author notes in the foreword of the 1994 reprint of this book that medical practices (both the culture, technology and finances) have changed significantly since the book was written, but that the text was left as is to give us a more complete glimpse into the past.	La autora menciona en el prólogo de la reimpresión de 1994 de su libro, que las prácticas médicas (tanto la cultura, la tecnología como las finanzas) han cambiado notablemente desde que se escribió el libro, pero que el texto no se alteró para darnos una perspectiva más amplia del pasado.	48	51140	El autor señala en el prólogo de la reimpresión de este libro en 1994 que las prácticas médicas (tanto la cultura, como la tecnología y las finanzas) han cambiado significativamente desde que se escribió el libro, pero que el texto se dejó como está para darnos una visión más completa de el pasado.	1.1	0:00:51	La autora señala en el prólogo de la reimpresión de este libro de 1994 que las prácticas médicas (tanto la cultura, como la tecnología y las finanzas) han cambiado significativamente desde que se escribió el libro, pero que el texto se dejó como está para darnos una visión más completa del pasado.	8.620689655
es	mtgen_a	professional	191	F	As the first Secretary of Education, Hufstedler's agenda has been depicted as being focused on strengthening state and federal interrelationships, as well as educational equity.	Como primera Secretaria de Educación, la agenda de Hufstedler ha sido representada como enfocada en el fortalecimiento de las interrelaciones estatales y federales, así como en la equidad educativa.	25	22937	Como primer Secretario de Educación, se ha descrito que la agenda de Hufstedler se centra en fortalecer las interrelaciones estatales y federales, así como la equidad educativa.	0.9	0:00:23	Como primera secretaria de Educación, se ha descrito que la agenda de Hufstedler se centra en fortalecer las interrelaciones estatales y federales, así como la equidad educativa.	6.666666667
es	mtgen_a	professional	97	F	From 1945 to 1946, Seibt was the first secretary of the Brandenburg district leadership and a member of the KPD Brandenburg state leadership.	De 1945 a 1946, Seibt fue la primera secretaria del liderazgo del distrito de Brandenburg y una miembro de la KDP Brandenburg state leadership.	23	55471	De 1945 a 1946, Seibt fue el primer secretario de la dirección del distrito de Brandeburgo y miembro de la dirección estatal del KPD de Brandeburgo.	2.4	0:00:55	De 1945 a 1946, Seibt fue la primera secretaria de la Dirección del Distrito de Brandeburgo y miembro de la Dirección Estatal del KPD de Brandeburgo.	25.0
es	mtgen_a	professional	917	F	From 1989 to 1995 Widder was scientific assistant at the University of Münster.	De 1989 a 1995 Widder fue asistente científica en la Universidad de Münster.	13	27938	De 1989 a 1995, Widder fue asistente científico en la Universidad de Münster.	2.1	0:00:28	De 1989 a 1995, Widder fue asistenta científica en la Universidad de Münster.	13.33333333
es	mtgen_a	professional	473	F	The decision of one of them to become a scientist leads to disapproval.	La decisión de una de ellas de ser científica conlleva desaprobación.	13	12130	La decisión de uno de ellos de convertirse en científico genera desaprobación.	0.9	0:00:12	La decisión de una de ellas de convertirse en científica genera desaprobación.	23.07692308
es	mtgen_a	professional	207	F	Also in 1968, the EEOC ruled that sex was not a bona fide occupational requirement to be a flight attendant.	También en 1968, la Comisión para la Igualdad de Oportunidades en el Empleo de los Estados Unidos (EEOC) dictó que el sexo no era un requisito profesional bona fide para ser azafata de vuelo.	20	49499	También en 1968, la EEOC dictaminó que el sexo no era un requisito ocupacional de buena fe para ser asistente de vuelo.	2.5	0:00:49	También en 1968, la EEOC dictaminó que el sexo no era un requisito ocupacional legítimo para ser azafata de vuelo.	16.66666667
es	mtgen_a	professional	99	F	Prowse is the author of A History of Newfoundland which is considered one of the most complete and meticulous colonial history books in existence.	Prowse es la autora de A History of Newfoundland, considerado uno de los libros de historia colonial más completos y meticulosos que existen.	24	14058	Prowse es el autor de Una historia de Terranova, considerado uno de los libros de historia colonial más completos y meticulosos que existen.	0.6	0:00:15	Prowse es la autora de Una historia de Terranova, considerado uno de los libros de historia colonial más completos y meticulosos que existen.	8.0
es	mtgen_a	professional	706	F	The exhibition assembled more than 100 seminal works (about 60 paintings and 40 drawings) that demonstrated the artist's range as a painter as well as a draftsman.	La exposición reunió más de 100 obras seminales (aproximadamente 60 pinturas y 40 dibujos) que demostraban el rango de la artista como pintora y como dibujante.	27	55937	La exposición reunió más de 100 obras fundamentales (alrededor de 60 pinturas y 40 dibujos) que demostraron el alcance del artista como pintor y dibujante.	2.1	0:00:56	La exposición reunió más de 100 obras fundamentales (alrededor de 60 pinturas y 40 dibujos) que demostraron el alcance de la artista como pintora y dibujante.	10.71428571
es	mtgen_a	professional	340	F	A renowned engineer and politically independent, Narutowicz was the first elected head of state following Poland's regained sovereignty from partitioning powers.	Narutowicz, ingeniera de renombre y políticamente independiente, fue la primera jefa de Estado elegida tras la recuperación de la soberanía de Polonia de las potencias partidoras.	21	72340	Narutowicz, un ingeniero de renombre y políticamente independiente, fue el primer jefe de estado electo después de que Polonia recuperara la soberanía de las potencias divididas.	3.4	0:01:12	Narutowicz, una ingeniera de renombre políticamente independiente, fue la primera jefa de estado electa después de que Polonia recuperara la soberanía de las potencias divididas.	24.13793103
es	mtgen_a	professional	202	F	The MEK has published a letter on Albanian media 2018, introducing Somayeh as its author.	La MEK ha publicado una carta en el medio de comunicación albano 2018, presentando a Somayeh como su autora.	15	34861	El MEK publicó una carta en los medios albaneses en 2018, presentando a Somayeh como su autor.	2.3	0:00:35	El MEK publicó una carta en los medios albaneses en 2018, presentando a Somayeh como su autora.	5.263157895
es	mtgen_a	professional	179	F	The album peaked at number 14 on the UK Classical Chart, and Brava became the biggest selling Finnish classical artist at the time.	El álbum alcanzó el número 14 en el UK Classical Chart, y Brava se convirtió en la artista clásica finlandesa más vendida del momento.	23	86129	El álbum alcanzó el puesto 14 en la lista de música clásica del Reino Unido y Brava se convirtió en el artista clásico finlandés con mayores ventas en ese momento.	3.7	0:01:26	El álbum alcanzó el puesto 14 en la lista de música clásica del Reino Unido y Brava se convirtió en la artista clásica finlandesa con mayores ventas en ese momento.	9.677419355
es	mtgen_a	professional	1075	F	The firm was initially supportive, but after it obtained phone records of calls between Newsweek writer Isikoff and the firm's office showing that Radack appeared to be the leaker of government emails, that changed.	La empresa al principio la apoyó, pero después de conseguir registros telefónicos entre el escritor de Newsweek Isikoff y la oficina de la empresa que sugerían que Radack era la que filtraba los correos del gobierno, eso cambió.	34	73279	La empresa inicialmente lo apoyó, pero después de obtener registros telefónicos de llamadas entre el escritor de Newsweek Isikoff y la oficina de la empresa que mostraban que Radack parecía ser el filtrador de correos electrónicos del gobierno, eso cambió.	2.2	0:01:13	La empresa inicialmente la apoyó, pero después de obtener registros telefónicos de llamadas entre la escritora de Newsweek Isikoff y la oficina de la empresa que mostraban que Radack parecía ser la persona que había filtrado los correos electrónicos del gobierno, eso cambió.	20.93023256
es	mtgen_a	professional	132	F	Bacellar was also a teacher of geography and of Brazilian Studies in military schools.	Bacellar también era profesora de Geografía y Estudios Brasileños en escuelas militares.	14	18862	Bacellar también fue profesor de geografía y de estudios brasileños en escuelas militares.	1.3	0:00:19	Bacellar también fue profesora de geografía y de estudios brasileños en escuelas militares.	7.142857143
es	mtgen_a	professional	145	F	Mulko is the artist who has drawn more episodes of Nippur; more than 150 in two stages: between 1972 and 1976, and between 1988 and 1994.	Mulko es la artista que más episodios de Nippur ha dibujado, más de 150 en dos etapas: de 1972 a 1976, y de 1988 a 1994.	26	14130	Mulko es el artista que ha dibujado más episodios de Nippur; más de 150 en dos etapas: entre 1972 y 1976, y entre 1988 y 1994.	0.5	0:00:14	Mulko es la artista que ha dibujado más episodios de Nippur; más de 150 en dos etapas: entre 1972 y 1976, y entre 1988 y 1994.	3.333333333
es	mtgen_a	professional	808	F	Shaham was editor-in-chief of Sifriat Poalim Publishing House.	Shaham fue editora en jefe de la editorial Sifriat Poalim.	8	24407	Shaham era editor en jefe de la editorial Sifriat Poalim.	3.1	0:00:24	Shaham era jefa de redacción de la editorial Sifriat Poalim.	27.27272727
es	mtgen_a	professional	945	F	Watters was a keen gardener and played contract bridge and mahjong to a high level.	Watters era una apasionada jardinera y jugaba al bridge y al mahjong a niveles altos.	15	15519	Watters era un gran jardinero y jugaba bridge y mahjong a un alto nivel.	1.0	0:00:16	Watters era una gran jardinera y jugaba al bridge y al mahjong a un alto nivel.	26.66666667
es	mtgen_a	professional	823	F	The doctor also takes time to solve a mystery with the aid of Kling, the Dog Detective.	La médica también se toma su tiempo para resolver un misterio con la ayuda de Kling, el Perro Detective.	17	54106	El médico también se toma su tiempo para resolver un misterio con la ayuda de Kling, el perro detective.	3.2	0:00:54	La doctora también se toma su tiempo para resolver un misterio con la ayuda de Kling, la perra detective.	19.04761905
